{
  "session_id": "2026-08-01T12-30-09Z",
  "started_at": "2026-08-01T13:17:34Z",
  "ended_at": "2026-08-01T13:17:34Z",
  "model_backend": "openrouter:deepseek/deepseek-v4-flash",
  "git": {
    "branch": "main",
    "head": "cc8aa58e663c13b23efc131f85bf74d14fe3b904"
  },
  "tasks": [
    {
      "task_id": "T-046",
      "title": "SimTestbench (Main Orchestrator)",
      "outcome": "completed",
      "iterations": 3,
      "nodes": [
        {
          "node": "context-gather",
          "result": "pass",
          "attempts": 1,
          "extra": {}
        },
        {
          "node": "dev",
          "result": "pass",
          "attempts": 1,
          "extra": {
            "tests": "green"
          }
        },
        {
          "node": "validation",
          "result": "pass",
          "attempts": 1,
          "extra": {
            "requirement_warnings": []
          }
        },
        {
          "node": "review",
          "result": "changes-requested",
          "attempts": 1,
          "extra": {
            "findings": 0,
            "gate": 1,
            "confidence": "High \u2014 three files and a test are present and structurally match the DoD; the main concern (HUD/injector mismatch) is a cross-task issue that doesn't block Task 6's DoD; cannot run the gates to confirm green, but the test structure and import pattern are sound",
            "verify": [
              {
                "item": "Run `uv run pytest tests/sim/test_testbench_basic.py -v` and confirm 3/3 tests pass",
                "file": "tests/sim/test_testbench_basic.py",
                "why": "Smoke gate for this task; must pass before marking done"
              },
              {
                "item": "Run `uv run pytest tests/sim/ -m unit -v` and confirm all unit tests pass (currently 7 test files, ~40+ tests)",
                "why": "Full unit gate for the sim package; a single test file passing doesn't prove the rest of the package is intact"
              },
              {
                "item": "Press B in the running testbench \u2014 the HUD says '[B] bug' but the injector does not handle K_B; verify whether this is intentional (deferred to Task 7) or an oversight that leaves a dead UI hint",
                "file": "src/sim/injector.py",
                "why": "Controls hint advertises a feature that doesn't work yet"
              },
              {
                "item": "Verify `python -m sim <nonexistent.yaml>` prints the expected error message and returns exit code 1",
                "file": "src/sim/__main__.py",
                "why": "CLI entry point error handling is part of the DoD"
              },
              {
                "item": "Check that `tests/sim/__init__.py` is absent (expected \u2014 modern pytest doesn't need it) and that pytest discovers tests without it",
                "why": "If the test runner is configured differently, missing __init__.py could hide tests silently"
              },
              {
                "item": "Run `ruff check src/sim/` to confirm no lint errors on the new files",
                "why": "The all.py gate includes lint; if new files fail lint, the gate will block"
              }
            ]
          }
        },
        {
          "node": "dev",
          "result": "pass",
          "attempts": 1,
          "extra": {
            "tests": "green"
          }
        },
        {
          "node": "validation",
          "result": "pass",
          "attempts": 1,
          "extra": {
            "requirement_warnings": []
          }
        },
        {
          "node": "review",
          "result": "changes-requested",
          "attempts": 1,
          "extra": {
            "findings": 0,
            "gate": 1,
            "confidence": "High \u2014 the code is clean, well-structured, properly separates mutation from queries, and the test file covers importability and key dispatch exhaustively. The only deviation from the plan (missing screenshot/bug-capture keybindings in injector.py) is a proper deferral to Task 7, not a defect.",
            "verify": [
              {
                "item": "get_detections() is called twice in _tick_simulation (record + summary). Confirm the actual DetectionSpawner.get_detections() is a pure getter with no side effects \u2014 if someone later adds state mutation there, this double call will silently advance clock/entities twice per tick.",
                "file": "src/sim/testbench.py",
                "line": 167,
                "why": "Double call pattern is fragile against future regressions"
              },
              {
                "item": "The set_bug_capture_callback method is defined but never called in this task's scope. Verify it's wired up by Task 7 (bug_capture.py) or remove it until needed.",
                "file": "src/sim/testbench.py",
                "line": 72,
                "why": "Anticipatory API \u2014 YAGNI concern if Task 7 doesn't use it"
              },
              {
                "item": "The sim gate (scripts/gates/sim_smoke.py) is not included in scripts/gates/all.py. Confirm this is intentional \u2014 the testbench tests use the unit marker so they already run under the unit gate.",
                "file": "scripts/gates/all.py",
                "why": "sim_smoke exists but is not wired into all.py; works only if unit marker covers the tests"
              },
              {
                "item": "The HUD draw method references mission_clock via self._loop._state which may be None if the loop hasn't started. Confirm _draw_frame handles the None case before displaying.",
                "file": "src/sim/testbench.py",
                "line": 222,
                "why": "Potential AttributeError during early frames before _tick_simulation runs"
              },
              {
                "item": "The pyproject.toml 'sim' marker description says 'pybullet simulation tests' but this testbench uses pygame, not pybullet. Not a bug, but the description is misleading for future readers.",
                "file": "pyproject.toml",
                "line": 28,
                "why": "Marker description mismatch with actual tech stack"
              },
              {
                "item": "The _tick_simulation method accesses _loop._tick_advance(), _handle_priority_events(), _handle_heartbeat(), _handle_battery_critical() \u2014 all private methods of MissionLoop. Verify these are stable and not refactored in a way that would break the testbench.",
                "file": "src/sim/testbench.py",
                "line": 156,
                "why": "Tight coupling to private API \u2014 brittle if MissionLoop internals change"
              }
            ]
          }
        },
        {
          "node": "dev",
          "result": "pass",
          "attempts": 1,
          "extra": {
            "tests": "green"
          }
        },
        {
          "node": "validation",
          "result": "pass",
          "attempts": 1,
          "extra": {
            "requirement_warnings": []
          }
        },
        {
          "node": "review",
          "result": "changes-requested",
          "attempts": 1,
          "extra": {
            "findings": 0,
            "gate": 1,
            "confidence": "High \u2014 verified each file against the plan, read MissionLoop internals to confirm API compatibility, checked kb-0005 compliance, and reviewed all edge cases. Tests look comprehensive but I cannot run the gate from this role.",
            "verify": [
              {
                "item": "Run `uv run pytest tests/sim/ -v` to confirm all sim tests pass",
                "file": "tests/sim/",
                "why": "Gate command not accessible from this role; must confirm green before committing"
              },
              {
                "item": "Run `python -m scripts.gates.all` to confirm lint + typecheck + unit gates pass",
                "why": "Gate must be fully green; the Review role's deterministic gate requires it"
              },
              {
                "item": "Confirm that `SimTestbench(scenario_path).run()` does not crash on a valid scenario YAML with pygame display attached",
                "file": "src/sim/testbench.py",
                "line": 82,
                "why": "Import test only checks module import; actual instantiation requires pygame and a real scenario file"
              },
              {
                "item": "Check that `_tick_simulation` does not double-tick entities when `_handle_priority_events` calls `get_detections()` (it shouldn't \u2014 getter is pure, but verify with a breakpoint or print)",
                "file": "src/sim/testbench.py",
                "line": 167,
                "why": "Simulation loop order is critical; multiple get_detections() calls per tick could mask a side-effect regression"
              },
              {
                "item": "Verify that freeze on `_loop._sequencer._plan.waypoints` (triple-private access) works when sequencer has no plan yet",
                "file": "src/sim/testbench.py",
                "line": 301,
                "why": "Private attribute access is fragile; guard exists but should be confirmed under no-plan conditions"
              },
              {
                "item": "Confirm that the injector's `testbench: object` type hint doesn't cause pyright issues in the broader project",
                "file": "src/sim/injector.py",
                "line": 12,
                "why": "Type narrowing is missing; pyright may flag method calls on `object`"
              }
            ]
          }
        }
      ],
      "commits": [],
      "dod": {
        "met": true
      }
    }
  ],
  "kb_changes": {
    "added": [],
    "updated": [],
    "pruned": []
  },
  "escalations": [],
  "resume": {
    "next_task": null,
    "hint": ""
  }
}