{
  "session_id": "2026-08-04T00-45-54Z",
  "started_at": "2026-08-04T22:47:22Z",
  "ended_at": "2026-08-04T22:47:22Z",
  "model_backend": "openrouter:deepseek/deepseek-v4-flash",
  "git": {
    "branch": "main",
    "head": "8d5f30c38ac74b1057ee5867bf3d5153e31f96ac"
  },
  "tasks": [
    {
      "task_id": "T-050",
      "title": "bug_to_task CLI Integration",
      "outcome": "rejected",
      "iterations": 1,
      "nodes": [
        {
          "node": "context-gather",
          "result": "reject",
          "attempts": 2,
          "extra": {
            "errors": [
              "<root>: 'task_id' is a required property",
              "<root>: 'generated_by' is a required property",
              "<root>: 'generated_at' is a required property",
              "<root>: 'coherence' is a required property",
              "<root>: 'context' is a required property"
            ],
            "backend_ok": false,
            "backend_raw": "pi_backend: agent killed after total timeout (idle=300.0s, total=1200.0s) -- it stalled or ran away without finishing. Treating this attempt as failed.\nPartial stdout follows:\n{\"type\":\"session\",\"version\":3,\"id\":\"019fca74-55dd-7b43-ad25-7b66ff45ce3b\",\"timestamp\":\"2026-08-04T01:47:29.629Z\",\"cwd\":\"C:\\\\coding\\\\pi-agent-factory\"}\n{\"type\":\"agent_start\"}\n"
          }
        }
      ],
      "commits": [],
      "dod": {
        "met": false
      }
    }
  ],
  "kb_changes": {
    "added": [],
    "updated": [],
    "pruned": []
  },
  "escalations": [],
  "resume": {
    "next_task": null,
    "hint": ""
  }
}