{
  "session_id": "2026-07-31T13-17-56Z",
  "started_at": "2026-07-31T13:21:32Z",
  "ended_at": "2026-07-31T13:21:32Z",
  "model_backend": "openrouter:deepseek/deepseek-v4-flash",
  "git": {
    "branch": "main",
    "head": "fea99a0407a25596a9d76e8168f7e5d144bc1994"
  },
  "tasks": [
    {
      "task_id": "T-043",
      "title": "Recorder (Mission Trace)",
      "outcome": "rejected",
      "iterations": 1,
      "nodes": [
        {
          "node": "context-gather",
          "result": "reject",
          "attempts": 2,
          "extra": {
            "errors": [
              "coherence: Additional properties are not allowed ('proven' was unexpected)",
              "coherence/checks/0: 'kind' is a required property",
              "coherence/checks/0: 'args' is a required property",
              "coherence/checks/0: Additional properties are not allowed ('evidence', 'pass' were unexpected)",
              "coherence/checks/1: 'kind' is a required property",
              "coherence/checks/1: 'args' is a required property",
              "coherence/checks/1: Additional properties are not allowed ('evidence', 'pass' were unexpected)",
              "coherence/checks/2: 'kind' is a required property",
              "coherence/checks/2: 'args' is a required property",
              "coherence/checks/2: Additional properties are not allowed ('evidence', 'pass' were unexpected)",
              "coherence/checks/3: 'kind' is a required property",
              "coherence/checks/3: 'args' is a required property",
              "coherence/checks/3: Additional properties are not allowed ('evidence', 'pass' were unexpected)",
              "coherence/checks/4: 'kind' is a required property",
              "coherence/checks/4: 'args' is a required property",
              "coherence/checks/4: Additional properties are not allowed ('evidence', 'pass' were unexpected)",
              "coherence/checks/5: 'kind' is a required property",
              "coherence/checks/5: 'args' is a required property",
              "coherence/checks/5: Additional properties are not allowed ('evidence', 'pass' were unexpected)"
            ]
          }
        }
      ],
      "commits": [],
      "dod": {
        "met": false
      }
    }
  ],
  "kb_changes": {
    "added": [],
    "updated": [],
    "pruned": []
  },
  "escalations": [],
  "resume": {
    "next_task": null,
    "hint": ""
  }
}