{
  "session_id": "2026-07-28T22-06-30Z",
  "started_at": "2026-07-28T22:10:01Z",
  "ended_at": "2026-07-28T22:10:01Z",
  "model_backend": "openrouter:deepseek/deepseek-v4-flash",
  "git": {
    "branch": "main",
    "head": "91da8aadacb061fc03a71eb18fe4674ac0019c76"
  },
  "tasks": [
    {
      "task_id": "T-039",
      "title": "MissionLoop",
      "outcome": "rejected",
      "iterations": 1,
      "nodes": [
        {
          "node": "context-gather",
          "result": "reject",
          "attempts": 2,
          "extra": {
            "errors": [
              "<root>: 'task_id' is a required property",
              "<root>: 'generated_by' is a required property",
              "<root>: 'generated_at' is a required property",
              "<root>: 'coherence' is a required property",
              "<root>: 'context' is a required property"
            ]
          }
        }
      ],
      "commits": [],
      "dod": {
        "met": false
      }
    }
  ],
  "kb_changes": {
    "added": [],
    "updated": [],
    "pruned": []
  },
  "escalations": [],
  "resume": {
    "next_task": null,
    "hint": ""
  }
}