{
  "session_id": "2026-07-31T14-00-05Z",
  "started_at": "2026-07-31T14:05:33Z",
  "ended_at": "2026-07-31T14:05:33Z",
  "model_backend": "openrouter:deepseek/deepseek-v4-flash",
  "git": {
    "branch": "main",
    "head": "c5edb1db9bbdc8b9328dd8e668c823e7535393a4"
  },
  "tasks": [
    {
      "task_id": "T-043",
      "title": "Recorder (Mission Trace)",
      "outcome": "rejected",
      "iterations": 1,
      "nodes": [
        {
          "node": "context-gather",
          "result": "reject",
          "attempts": 2,
          "extra": {
            "errors": [
              "coherence: Additional properties are not allowed ('proven' was unexpected)"
            ]
          }
        }
      ],
      "commits": [],
      "dod": {
        "met": false
      }
    }
  ],
  "kb_changes": {
    "added": [],
    "updated": [],
    "pruned": []
  },
  "escalations": [],
  "resume": {
    "next_task": null,
    "hint": ""
  }
}