{
  "session_id": "2026-07-31T13-27-07Z",
  "started_at": "2026-07-31T13:56:50Z",
  "ended_at": "2026-07-31T13:56:50Z",
  "model_backend": "openrouter:deepseek/deepseek-v4-flash",
  "git": {
    "branch": "main",
    "head": "fea99a0407a25596a9d76e8168f7e5d144bc1994"
  },
  "tasks": [
    {
      "task_id": "T-042",
      "title": "Detection Spawner",
      "outcome": "completed",
      "iterations": 2,
      "nodes": [
        {
          "node": "context-gather",
          "result": "already-done",
          "attempts": 1,
          "extra": {}
        },
        {
          "node": "validation",
          "result": "pass",
          "attempts": 1,
          "extra": {}
        },
        {
          "node": "review",
          "result": "changes-requested",
          "attempts": 1,
          "extra": {
            "findings": 0,
            "gate": 1,
            "confidence": "High \u2014 all DoD items are clearly met: Perception protocol is implemented correctly, tests are comprehensive and well-structured, the implementation is clean and improvements over the plan are sound. Cannot verify gate exit code (bash disabled) but code quality is solid.",
            "verify": [
              {
                "item": "Run `uv run pytest tests/sim/test_detection_spawner.py -v` and confirm all 8 tests pass (0 failures)",
                "file": "tests/sim/test_detection_spawner.py",
                "why": "Gate verification \u2014 each test exercises a distinct behavior, including edge cases like delayed spawning, pure-getter semantics, and seed determinism"
              },
              {
                "item": "Run `scripts/gates/all.py` and confirm exit code 0 (lint + types + unit)",
                "why": "Full gate check \u2014 the review gate blocks on any gate failure regardless of dod_met"
              },
              {
                "item": "Confirm that DetectionSpawner passes isinstance(spawner, Perception) at runtime (the Perception protocol is @runtime_checkable)",
                "file": "src/sim/detection_spawner.py",
                "line": 30,
                "why": "DoD requires the class implements the Perception protocol; runtime_checkable checks structural subtyping, not just duck typing"
              },
              {
                "item": "Verify that spawn_entity('shark') with no matching SpawnerRule for 'shark' still produces a valid entity (fallback to inside_polygon(sea_polygon))",
                "file": "src/sim/detection_spawner.py",
                "line": 109,
                "why": "Manual keyboard injection relies on this fallback; if the spawner defs list has no 'shark' rule, the method should still work"
              },
              {
                "item": "Check that _random_position_in_pool for a non-rectangular polygon doesn't place entities noticeably outside the pool (e.g., a concave polygon)",
                "file": "src/sim/detection_spawner.py",
                "line": 168,
                "why": "Implementation uses bounding-box uniform sampling, not actual polygon-point-inclusion; for complex polygons this could place entities outside the intended zone"
              },
              {
                "item": "Confirm _spawn_pending_entities doesn't re-spawn if a scenario has two SpawnerRules with the same label but different start_times",
                "file": "src/sim/detection_spawner.py",
                "line": 140,
                "why": "The 'already_spawned' guard keys on label alone; two rules sharing a label would cause the second to never spawn"
              }
            ]
          }
        },
        {
          "node": "dev",
          "result": "pass",
          "attempts": 1,
          "extra": {
            "tests": "green"
          }
        },
        {
          "node": "validation",
          "result": "pass",
          "attempts": 1,
          "extra": {}
        },
        {
          "node": "review",
          "result": "pass",
          "attempts": 1,
          "extra": {
            "confidence": "High \u2014 implementation matches the plan, improves the design, and tests cover all key behaviors including pure-getter invariant and delayed spawning",
            "verify": [
              {
                "item": "Run tests/sim/test_detection_spawner.py and confirm all 7 tests pass",
                "file": "tests/sim/test_detection_spawner.py",
                "why": "Cannot run tests from this role; final gate check needed"
              },
              {
                "item": "Run the full gate (scripts/gates/all.py) to confirm lint + types + unit pass",
                "why": "Known issue kb-0002: full suite may exceed 120s timeout; run with --timeout=0 or increase timeout"
              },
              {
                "item": "Verify DetectionSpawner passes isinstance check against Perception protocol: isinstance(spawner, Perception) should be True",
                "file": "src/sim/detection_spawner.py",
                "why": "Protocol structural subtyping \u2014 method name must match exactly"
              },
              {
                "item": "Check that SpawnerRule.interval field is deliberately unused (no periodic respawn loop) \u2014 confirm this is intentional per the plan",
                "file": "src/sim/detection_spawner.py",
                "why": "interval is stored in the dataclass but never consumed by detection_spawner.py"
              },
              {
                "item": "Confirm that the tests/sim/__init__.py exists (or verify pytest can discover tests/sim/ without it)",
                "file": "tests/sim/",
                "why": "Missing __init__.py can cause import/discovery issues in some pytest configurations"
              }
            ]
          }
        }
      ],
      "commits": [],
      "dod": {
        "met": true
      }
    }
  ],
  "kb_changes": {
    "added": [],
    "updated": [],
    "pruned": []
  },
  "escalations": [],
  "resume": {
    "next_task": null,
    "hint": ""
  }
}