{
  "session_id": "2026-07-27T21-21-34Z",
  "started_at": "2026-07-27T22:04:04Z",
  "ended_at": "2026-07-27T22:04:04Z",
  "model_backend": "openrouter:deepseek/deepseek-v4-flash",
  "git": {
    "branch": "main",
    "head": "ab7f7a1711805c2d9c91fcae73b5ec0e90eaeaab"
  },
  "tasks": [
    {
      "task_id": "T-035",
      "title": "ScriptedPerception",
      "outcome": "completed",
      "iterations": 3,
      "nodes": [
        {
          "node": "context-gather",
          "result": "pass",
          "attempts": 1,
          "extra": {}
        },
        {
          "node": "dev",
          "result": "pass",
          "attempts": 1,
          "extra": {
            "tests": "green"
          }
        },
        {
          "node": "validation",
          "result": "pass",
          "attempts": 1,
          "extra": {}
        },
        {
          "node": "review",
          "result": "pass",
          "attempts": 1,
          "extra": {}
        },
        {
          "node": "dev",
          "result": "pass",
          "attempts": 1,
          "extra": {
            "tests": "green"
          }
        },
        {
          "node": "validation",
          "result": "pass",
          "attempts": 1,
          "extra": {}
        },
        {
          "node": "review",
          "result": "changes-requested",
          "attempts": 1,
          "extra": {
            "findings": 0,
            "gate": 0
          }
        },
        {
          "node": "dev",
          "result": "pass",
          "attempts": 1,
          "extra": {
            "tests": "green"
          }
        },
        {
          "node": "validation",
          "result": "pass",
          "attempts": 1,
          "extra": {}
        },
        {
          "node": "review",
          "result": "pass",
          "attempts": 1,
          "extra": {}
        }
      ],
      "commits": [],
      "dod": {
        "met": true
      }
    }
  ],
  "kb_changes": {
    "added": [],
    "updated": [],
    "pruned": []
  },
  "escalations": [],
  "resume": {
    "next_task": null,
    "hint": ""
  }
}