{
  "session_id": "2026-07-27T14-29-58Z",
  "started_at": "2026-07-27T14:29:58Z",
  "ended_at": "2026-07-27T17:30:00Z",
  "model_backend": "openrouter:deepseek/deepseek-v4-flash",
  "git": {
    "branch": "main",
    "head": "579f61c03ab9069d375764ab8b75c6fa07971b2d"
  },
  "tasks": [
    {
      "task_id": "T-032",
      "title": "WaypointSequencer",
      "outcome": "escalated",
      "iterations": 3,
      "nodes": [
        {
          "node": "context-gather",
          "result": "pass",
          "attempts": 1,
          "extra": {}
        },
        {
          "node": "dev",
          "result": "pass",
          "attempts": 1,
          "extra": {
            "tests": "green"
          }
        },
        {
          "node": "validation",
          "result": "pass",
          "attempts": 1,
          "extra": {}
        },
        {
          "node": "review",
          "result": "pass",
          "attempts": 1,
          "extra": {}
        },
        {
          "node": "dev",
          "result": "pass",
          "attempts": 2,
          "extra": {
            "tests": "green"
          }
        },
        {
          "node": "validation",
          "result": "pass",
          "attempts": 1,
          "extra": {}
        },
        {
          "node": "review",
          "result": "changes-requested",
          "attempts": 1,
          "extra": {
            "findings": 0,
            "gate": 1
          }
        },
        {
          "node": "dev",
          "result": "pass",
          "attempts": 1,
          "extra": {
            "tests": "green"
          }
        },
        {
          "node": "validation",
          "result": "pass",
          "attempts": 1,
          "extra": {}
        },
        {
          "node": "review",
          "result": "changes-requested",
          "attempts": 1,
          "extra": {
            "findings": 0,
            "gate": 1
          }
        },
        {
          "node": "human-review",
          "result": "changes-requested",
          "attempts": 1,
          "extra": {
            "handoff": "rejected: dev will retry"
          }
        },
        {
          "node": "session-review",
          "result": "pass",
          "attempts": 1,
          "extra": {}
        }
      ],
      "commits": ["a5f12c0", "579f61c"],
      "dod": {
        "met": true
      }
    }
  ],
  "kb_changes": {
    "added": ["kb-0003"],
    "updated": [],
    "pruned": []
  },
  "escalations": [
    "T-032"
  ],
  "resume": {
    "next_task": null,
    "hint": ""
  }
}