{
  "session_id": "2026-07-31T09-38-24Z",
  "started_at": "2026-07-31T10:55:45Z",
  "ended_at": "2026-07-31T10:55:45Z",
  "model_backend": "openrouter:deepseek/deepseek-v4-flash",
  "git": {
    "branch": "design/system-requirement-validation",
    "head": "bbbec1ec259099b09b14af024b9670e02bb2a89a"
  },
  "tasks": [
    {
      "task_id": "T-042",
      "title": "Detection Spawner",
      "outcome": "completed",
      "iterations": 3,
      "nodes": [
        {
          "node": "context-gather",
          "result": "already-done",
          "attempts": 1,
          "extra": {}
        },
        {
          "node": "validation",
          "result": "pass",
          "attempts": 1,
          "extra": {}
        },
        {
          "node": "review",
          "result": "changes-requested",
          "attempts": 1,
          "extra": {
            "findings": 2,
            "gate": 1,
            "confidence": "High \u2014 code is clean and functional, but the flaky test and clock-side-effect design issue are real concerns that will surface in CI or long-running sims",
            "verify": [
              {
                "item": "Run the full test suite 3\u00d7 to see if the flaky confidence test ever fails",
                "file": "tests/sim/test_detection_spawner.py",
                "line": 47,
                "why": "random.uniform in test can produce position near (0,0) causing false fail"
              },
              {
                "item": "Confirm the testbench calls get_detections() only once per tick, or verify the clock-advance in get_detections() doesn't break spawn timers in practice",
                "file": "src/sim/detection_spawner.py",
                "line": 72,
                "why": "clock advances 0.05 per call, but testbench calls it 3\u00d7 per tick"
              },
              {
                "item": "Check that spawn_entity with a label not in spawner_defs (e.g. 'shark' when only 'swimmer' is defined) works correctly \u2014 it uses default pool/speed, which is fine but should be documented",
                "file": "src/sim/detection_spawner.py",
                "line": 93,
                "why": "fallback to default pool/speed is implicit behavior"
              },
              {
                "item": "Verify that the interval field in SpawnerRule is intentionally unused (task 1 carry-over, not a regression)",
                "file": "src/sim/scenario.py",
                "line": 19,
                "why": "interval is defined but never read by DetectionSpawner"
              },
              {
                "item": "Confirm the tests/sim/__init__.py file is missing (plan says to create it) \u2014 check if pytest discovery works without it",
                "file": "tests/sim/__init__.py",
                "why": "plan step 5 includes it in git add but file may not exist"
              }
            ]
          }
        },
        {
          "node": "dev",
          "result": "pass",
          "attempts": 1,
          "extra": {
            "tests": "green"
          }
        },
        {
          "node": "validation",
          "result": "pass",
          "attempts": 1,
          "extra": {}
        },
        {
          "node": "review",
          "result": "changes-requested",
          "attempts": 1,
          "extra": {
            "findings": 0,
            "gate": 1,
            "confidence": "High \u2014 implementation is cleaner than the plan (separate tick/get_detections, removed unused fields, added seed). I cannot run the tests or git commands from this role, so I rely on the deterministic gate pipeline to verify they pass. No finding rises to the level of blocking the task.",
            "verify": [
              {
                "item": "Run `uv run pytest tests/sim/test_detection_spawner.py -v` and confirm all 8 tests pass",
                "file": "tests/sim/test_detection_spawner.py",
                "why": "I cannot verify test results from this role; the gate will catch failures, but a human should confirm before approving"
              },
              {
                "item": "Check that test_confidence_decreases_with_distance with seed=42 actually produces a shark position far enough from origin (far_conf < 0.5). If the RNG behavior changes across Python versions, this assertion could flake.",
                "file": "tests/sim/test_detection_spawner.py",
                "line": 72,
                "why": "The assertion far_conf < 0.5 depends on seed 42 producing a position >50m from origin; deterministic but fragile"
              },
              {
                "item": "Confirm that the DetectionSpawner is used with tick(dt) in the SimTestbench, NOT with the old pattern where get_detections() itself advances the clock. The testbench in the plan was written against the old API and may need updating.",
                "file": "src/sim/testbench.py",
                "why": "The plan's testbench calls get_detections() without tick(); the new API requires explicit tick(dt) calls. This is a cross-task integration concern (Task 6 vs Task 2), not a Task 2 bug, but it will break at runtime if not addressed."
              },
              {
                "item": "Verify that _spawn_pending_entities handles the edge case of two SpawnerRules with the same label but different start_times \u2014 currently the label-based uniqueness check means only the first one spawns.",
                "file": "src/sim/detection_spawner.py",
                "line": 107,
                "why": "already_spawned checks e.label == spawner.label; if two spawners share a label, the second is silently skipped. This is a very unlikely scenario but could be surprising."
              },
              {
                "item": "Run `uv run pytest -m unit -q` (the unit gate) to confirm the full unit suite is green, not just the new test file",
                "why": "The deterministic gate checks all unit tests, not just the new ones; regressions in other tests would block the gate"
              }
            ]
          }
        },
        {
          "node": "dev",
          "result": "pass",
          "attempts": 2,
          "extra": {
            "tests": "green"
          }
        },
        {
          "node": "validation",
          "result": "pass",
          "attempts": 1,
          "extra": {}
        },
        {
          "node": "review",
          "result": "pass",
          "attempts": 1,
          "extra": {
            "confidence": "Medium \u2014 I cannot run bash (disabled for this role), so gate verification is static. Pipeline gate runs independently. Main uncertainty: seed=42 assertion in test_confidence_decreases_with_distance passes deterministically.",
            "verify": [
              {
                "item": "Task 6 testbench must call spawner.tick(dt) \u2014 the pure-getter design means entity movement and delayed spawns only happen on tick(), not get_detections()",
                "file": "src/sim/testbench.py",
                "why": "Plan reference code for Task 6 never calls tick(); integration would break without it"
              },
              {
                "item": "Run: 'uv run pytest tests/sim/test_detection_spawner.py -v' \u2014 confirm seed=42 assertion passes (far_conf < 0.5)",
                "file": "tests/sim/test_detection_spawner.py",
                "line": 60,
                "why": "Seed-dependent; must pass on the actual Python version/random implementation"
              },
              {
                "item": "Run: 'scripts/gates/all.py' \u2014 confirm lint + types + unit pass",
                "why": "Full gate runs independently; verify it's green"
              },
              {
                "item": "spawn_entity with a label not in spawner_defs defaults to sea_polygon + speed=1.0 \u2014 confirm this is intended for keyboard injection fallback",
                "file": "src/sim/detection_spawner.py",
                "line": 100,
                "why": "No test covers this fallback path; human should confirm correctness"
              },
              {
                "item": "Multiple SpawnerRules with the same label but different start_times \u2014 second never spawns due to label-based dedup in _spawn_pending_entities",
                "file": "src/sim/detection_spawner.py",
                "line": 130,
                "why": "Edge case inherited from plan; confirm no test/requirement depends on same-label multi-spawner"
              },
              {
                "item": "Entity creation is duplicated in __init__ (line 50), spawn_entity (line 104), and _spawn_pending_entities (line 134) \u2014 minor DRY violation, accept if no more spawn paths planned",
                "file": "src/sim/detection_spawner.py",
                "why": "Three near-identical blocks; refactor if a fourth spawn path appears"
              }
            ]
          }
        }
      ],
      "commits": [],
      "dod": {
        "met": true
      }
    }
  ],
  "kb_changes": {
    "added": [],
    "updated": [],
    "pruned": []
  },
  "escalations": [],
  "resume": {
    "next_task": null,
    "hint": ""
  }
}