{
  "session_id": "2026-07-27T20-00-48Z",
  "started_at": "2026-07-27T21:20:58Z",
  "ended_at": "2026-07-27T21:20:58Z",
  "model_backend": "openrouter:deepseek/deepseek-v4-flash",
  "git": {
    "branch": "main",
    "head": "55094102639a160e9fd6455675db6e6ace405af3"
  },
  "tasks": [
    {
      "task_id": "T-034",
      "title": "PerimeterSweepAlgorithm",
      "outcome": "completed",
      "iterations": 1,
      "nodes": [
        {
          "node": "context-gather",
          "result": "pass",
          "attempts": 2,
          "extra": {}
        },
        {
          "node": "dev",
          "result": "pass",
          "attempts": 1,
          "extra": {
            "tests": "green"
          }
        },
        {
          "node": "validation",
          "result": "pass",
          "attempts": 1,
          "extra": {}
        },
        {
          "node": "review",
          "result": "pass",
          "attempts": 1,
          "extra": {}
        }
      ],
      "commits": [],
      "dod": {
        "met": true
      }
    }
  ],
  "kb_changes": {
    "added": [],
    "updated": [],
    "pruned": []
  },
  "escalations": [],
  "resume": {
    "next_task": null,
    "hint": ""
  }
}